Category,Subcategory,Strength,Multiplier,en,de
0,0,4,1,Most or all of the economy should be nationalized,Die Wirtschaft sollte zum großen Teil oder komplett verstaatlicht werden
0,1,1,-1,Regulation cannot fix all problems in the economy,Regulierung kann nicht alle wirtschaftlichen Probleme lösen
0,2,4,1,The government should not regulate the economy at all,Der Staat sollte die Wirtschaft gar nicht regulieren.
1,1,3,1,"If you have nothing to hide, you should have nothing to fear from the government monitoring your communications","Wenn man nichts zu verbergen hat, sollte man keine Angst davor haben, dass die Regierung die Kommunikation überwacht"
1,2,4,1,People who spread misinformation should be punished,"Menschen die Unwahrheiten verbreiten, sollten bestraft werden"
1,0,1,-1,You should not have complete freedom of speech,Man sollte keine totale Meinungsfreiheit haben
2,0,4,-1,Abortion should always be legal,Abtreibung sollte immer legal sein
2,1,1,1,Climate change is a real threat,Klimawandel ist eine wirkliche Gefahr
